{
  "manifest_version": "experiment_manifest.v1",
  "experiment_id": "classification_benchmark_smoke",
  "description": "Fast CI smoke subset of classification benchmark v1.",
  "dataset_version": "v1",
  "dataset_path": "benchmarks/dataset_v1",
  "baselines": ["B0", "B3"],
  "random_seed": 42,
  "bootstrap_iterations": 200,
  "confidence_level": 0.95,
  "smoke_case_limit": 8,
  "output_subdirs": {
    "raw": "experiments/raw_results",
    "processed": "experiments/processed_results"
  },
  "research_question_ref": "RESEARCH.md#primary-research-question"
}
